idCourse,mpidCourse,idCategory,code,uidCourse,name,description,lang_code,status,level_show_user,subscribe_method,linkSponsor,imgSponsor,img_course,img_demothumb,img_material,img_othermaterial,player_bg,player_bg_aspect,course_demo,mediumTime,permCloseLO,userStatusOp,difficult,show_progress,show_time,show_who_online,show_extra_info,show_rules,date_begin,date_end,hour_begin,hour_end,valid_time,valid_time_type,abs_max_subscriptions,max_num_subscribe,min_num_subscribe,max_sms_budget,selling,prize,course_type,policy_point,point_to_all,course_edition,classrooms,certificates,create_date,security_code,imported_from_connection,course_quota,used_space,course_vote,allow_overbooking,can_subscribe,completion_rule,completion_rule_percentage,enable_self_unenrollment,enable_unenrollment_on_course_completion,enable_session_change,enable_session_self_unenrollment,sub_start_date,sub_end_date,advance,autoregistration_code,direct_play,use_logo_in_courselist,show_result,credits,auto_unsubscribe,unsubscribe_date_limit,prerequisites_policy,player_layout,social_rating_settings,social_sharing_settings,resume_autoplay,enable_coaching,learner_assignment,coaching_option_allow_start_course,coaching_option_allow_request_session_change,final_score_mode,final_object,soft_deadline,initial_score_mode,initial_object,deep_link,id_publisher,publish_date,coaching_option_access_without_assign_coach,allow_automatically_enroll,slug_name,lo_max_attempts,show_toc,has_overview,affiliate_price,enable_partner_fields_editing,id_partner,partner_fields,external_provider_id,external_course_id,last_update,show_lightbox_nav,date_deleted,created_from,author_id,has_esignature_enabled,formetris_enabled,esignature_title,esignature_description,decommissioned_at,removed_at,impact_reg_date,catalog_show_alternative_learning_plans,catalog_show_alternative_subscription_plans,catalog_show_buy_now,ecommerce_pricing_system_default,course_cover,short_description,rsvp_enabled
65,0,16,29BOPR-Course,E-71KLD0,Basic Orientation Plus Refresher and Test,"<p style=\"margin:0px 0px 10px;color:rgb(85,85,85);font-family:'Open Sans', Arial, 'Arial Unicode MS', Helvetica, sans-serif;font-size:14px;font-style:normal;font-weight:400;letter-spacing:normal;text-indent:0px;text-transform:none;white-space:normal;word-spacing:0px;background-color:rgb(255,255,255);\"><strong><span style=\"color:rgb(41,105,176);\">Course Description</span></strong></p><p style=\"margin:0px 0px 10px;color:rgb(85,85,85);font-family:'Open Sans', Arial, 'Arial Unicode MS', Helvetica, sans-serif;font-size:14px;font-style:normal;font-weight:400;letter-spacing:normal;text-indent:0px;text-transform:none;white-space:normal;word-spacing:0px;background-color:rgb(255,255,255);\">The  <strong>Basic Orientation Plus-Refresher® </strong>is designed to re-inform and update the experienced employee on <span style=\"color:rgb(85,85,85);font-family:'Open Sans', Arial, 'Arial Unicode MS', Helvetica, sans-serif;font-size:14px;font-style:normal;font-weight:400;letter-spacing:normal;text-indent:0px;text-transform:none;white-space:normal;word-spacing:0px;background-color:rgb(255,255,255);display:inline;float:none;\">general safety rules, regulations, practices, and principles associated with the construction and contract maintenance/services industry</span>
. This course will qualify as an OSHA mandated orientation. The following topics are covered in this orientation: </p><ul style=\"margin-top:0px;margin-bottom:10px;padding-left:10px;color:rgb(85,85,85);font-family:'Open Sans', Arial, 'Arial Unicode MS', Helvetica, sans-serif;font-size:14px;font-style:normal;font-weight:400;letter-spacing:normal;text-indent:0px;text-transform:none;white-space:normal;word-spacing:0px;background-color:rgb(255,255,255);\"><li style=\"list-style-position:outside;\">Hazard Communication (HazCom) and Chemical Safety </li><li style=\"list-style-position:outside;\">Globally Harmonized System (GHS) </li><li style=\"list-style-position:outside;\">Personal Protective Equipment (PPE) </li><li style=\"list-style-position:outside;\">Process Safety Management (PSM) </li><li style=\"list-style-position:outside;\">Hearing Conservation </li><li style=\"list-style-position:outside;\">Electrical Safety Related Work Practices for Non-Qualified Workers </li><li style=\"list-style-position:outside;\">Lockout/Tagout</li><li style=\"list-style-position:outside;\">Respiratory Protection </li><li style=\"list-style-position:outside;\">Elevated Work  </li><li style=\"list-style-position:outside;\">Fall Protection</li><li style=\"list-style-position:outside;\">Scaffolding</li><li style=\"list-style-position:outside;\">Ladders</li><li style=\"list-style-position:outside;\">General Rules &amp; Emergency Procedures</li><li style=\"list-style-position:outside;\">Accident Prevention, Signs and Tags</li><li style=\"list-style-position:outside;\">Materials Handling and Storage</li><li style=\"list-style-position:outside;\">Job Safety Analysis (JSA), Job Hazard Analysis (JHA) </li><li style=\"list-style-position:outside;\">Excavation, Trenching &amp; Shoring</li><li style=\"list-style-position:outside;\">Emergency Action Plans</li><li style=\"list-style-position:outside;\">General Safety and Emergency Procedures</li><li style=\"list-style-position:outside;\">Fire Prevention </li></ul>",english,2,0,false,"","",330,"","","",321,fill,"",0,false,0,medium,true,false,false,false,true,"","","","",0,false,0,0,0,0.0,false,"",elearning,"",0,false,"","",1599700911000,"","",-1,0,0.0,false,false,true,"",false,true,false,false,"","","","",false,false,false,0.00,false,"",true,"","","",true,false,true,false,false,single_LO_as_final,297,"",single_LO_as_initial,297,false,"","",false,false,basic-orientation-plus-refresher-and-test,1,"","","",false,"","","","",1614289226000,"","",3,13037,false,false,"","","","","","","","","","","",false
1,0,2,BPI Classrooom,I-E0JM0Z,BP Induction (Classroom),"<p>This course is intended to inform personnel about the work that BP does on the North Slope of Alaska. You will discuss the hazards that may be encountered in Prudhoe Bay and in the oil &amp; gas industry in Alaska, emergency information, camps and facilities details, road and weather conditions, safe driving rules and much more. This course is required for all personnel working on BP sites and/or projects in Alaska.</p>",english,0,0,true,http://,"",1,"","","","","","",0,false,0,medium,true,true,true,false,false,"","",-1,-1,0,false,0,0,0,0.0,false,"",classroom,"",0,false,"","",1561485889000,"","",-1,0,0.0,true,true,true,"",true,false,true,true,"","","","",false,true,false,0.00,false,"",true,"","","",true,false,true,false,false,"",156,"","",156,false,"","",false,true,bp-induction-classroom,"","","","",false,"","","","",1651483001000,"","",0,13028,false,false,"","","","","","","","","","","",false
140,0,22,NSTC-17MEM,E-E1LJL0,Confined Space Entry,"<ul style=\"margin-bottom:0in;color:rgb(32,31,30);font-family:'Segoe UI', 'Segoe UI', '-apple-system', BlinkMacSystemFont, Roboto, 'Helvetica Neue', sans-serif;font-size:15px;font-style:normal;font-weight:400;letter-spacing:normal;text-indent:0px;text-transform:none;white-space:normal;word-spacing:0px;background-color:rgb(255,255,255);margin-top:0in;\" type=\"circle\"><li style=\"margin:0in;font-size:11pt;font-family:Calibri, sans-serif;\"><span style=\"margin:0px;padding:0px;border:0px;font-style:inherit;font-variant:inherit;font-weight:inherit;font-size:10pt;line-height:inherit;font-family:Arial, sans-serif;vertical-align:baseline;color:inherit;\">Describe the characteristics of a confined space.</span></li><li style=\"margin:0in;font-size:11pt;font-family:Calibri, sans-serif;\"><span style=\"margin:0px;padding:0px;border:0px;font-style:inherit;font-variant:inherit;font-weight:inherit;font-size:10pt;line-height:inherit;font-family:Arial, sans-serif;vertical-align:baseline;color:inherit;\">Identify the hazards associated with entering and/or working in a confined space.</span></li><li style=\"margin:0in;font-size:11pt;font-family:Calibri, sans-serif;\"><span style=\"margin:0px;padding:0px;border:0px;font-style:inherit;font-variant:inherit;font-weight:inherit;font-size:10pt;line-height:inherit;font-family:Arial, sans-serif;vertical-align:baseline;color:inherit;\">Institute appropriate controls, safeguards, and actions to protect personnel.</span></li><li style=\"margin:0in;font-size:11pt;font-family:Calibri, sans-serif;\"><span style=\"margin:0px;padding:0px;border:0px;font-style:inherit;font-variant:inherit;font-weight:inherit;font-size:10pt;line-height:inherit;font-family:Arial, sans-serif;vertical-align:baseline;color:inherit;\">Explain what permits are required for working in a confined space.</span></li><li style=\"margin:0in;font-size:11pt;font-family:Calibri, sans-serif;\"><span style=\"margin:0px;padding:0px;border:0px;font-style:inherit;font-variant:inherit;font-weight:inherit;font-size:10pt;line-height:inherit;font-family:Arial, sans-serif;vertical-align:baseline;color:inherit;\">Explain the six steps for working safely within a confined space.</span></li><li style=\"margin:0in;font-size:11pt;font-family:Calibri, sans-serif;\"><span style=\"margin:0px;padding:0px;border:0px;font-style:inherit;font-variant:inherit;font-weight:inherit;font-size:10pt;line-height:inherit;font-family:Arial, sans-serif;vertical-align:baseline;color:inherit;\">Explain the confined space entry requirements detailed in the Alaska Safety Handbook.</span></li></ul>",english,2,0,true,"","",503,"","","","","","",5400,false,0,medium,true,false,false,false,false,"","","","",0,false,0,0,0,0.0,true,60,elearning,"",0,false,"","",1639597900000,"","",-1,0,0.0,false,true,true,"",false,true,false,false,"","","","",false,false,false,0.00,false,"",true,"","","",true,false,true,false,false,"",700,"","",700,false,"","",false,false,confined-space-entry,3,"","","",false,"","","","",1640737525000,"","",3,13667,false,false,"","","","","","","","","","","",false
155,0,22,NSTC-17NON,E-P08260,Confined Space Entry,"<ul style=\"margin-bottom:0in;color:rgb(32,31,30);font-family:'Segoe UI', 'Segoe UI', '-apple-system', BlinkMacSystemFont, Roboto, 'Helvetica Neue', sans-serif;font-size:15px;font-style:normal;font-weight:400;letter-spacing:normal;text-indent:0px;text-transform:none;white-space:normal;word-spacing:0px;background-color:rgb(255,255,255);margin-top:0in;\" type=\"circle\"><li style=\"margin:0in;font-size:11pt;font-family:Calibri, sans-serif;\"><span style=\"margin:0px;padding:0px;border:0px;font-style:inherit;font-variant:inherit;font-weight:inherit;font-size:10pt;line-height:inherit;font-family:Arial, sans-serif;vertical-align:baseline;color:inherit;\">Describe the characteristics of a confined space.</span></li><li style=\"margin:0in;font-size:11pt;font-family:Calibri, sans-serif;\"><span style=\"margin:0px;padding:0px;border:0px;font-style:inherit;font-variant:inherit;font-weight:inherit;font-size:10pt;line-height:inherit;font-family:Arial, sans-serif;vertical-align:baseline;color:inherit;\">Identify the hazards associated with entering and/or working in a confined space.</span></li><li style=\"margin:0in;font-size:11pt;font-family:Calibri, sans-serif;\"><span style=\"margin:0px;padding:0px;border:0px;font-style:inherit;font-variant:inherit;font-weight:inherit;font-size:10pt;line-height:inherit;font-family:Arial, sans-serif;vertical-align:baseline;color:inherit;\">Institute appropriate controls, safeguards, and actions to protect personnel.</span></li><li style=\"margin:0in;font-size:11pt;font-family:Calibri, sans-serif;\"><span style=\"margin:0px;padding:0px;border:0px;font-style:inherit;font-variant:inherit;font-weight:inherit;font-size:10pt;line-height:inherit;font-family:Arial, sans-serif;vertical-align:baseline;color:inherit;\">Explain what permits are required for working in a confined space.</span></li><li style=\"margin:0in;font-size:11pt;font-family:Calibri, sans-serif;\"><span style=\"margin:0px;padding:0px;border:0px;font-style:inherit;font-variant:inherit;font-weight:inherit;font-size:10pt;line-height:inherit;font-family:Arial, sans-serif;vertical-align:baseline;color:inherit;\">Explain the six steps for working safely within a confined space.</span></li><li style=\"margin:0in;font-size:11pt;font-family:Calibri, sans-serif;\"><span style=\"margin:0px;padding:0px;border:0px;font-style:inherit;font-variant:inherit;font-weight:inherit;font-size:10pt;line-height:inherit;font-family:Arial, sans-serif;vertical-align:baseline;color:inherit;\">Explain the confined space entry requirements detailed in the Alaska Safety Handbook.</span></li></ul>",english,2,0,true,"","",503,"","","","","","",5400,false,0,medium,true,false,false,false,false,"","","","",0,false,0,0,0,0.0,true,75,elearning,"",0,false,"","",1639775236000,"","",-1,0,0.0,false,true,true,"",false,true,false,false,"","","","",false,false,false,0.00,false,"",true,"","","",true,false,true,false,false,"",678,"","",678,false,"","",false,false,confined-space-entry,3,"","","",false,"","","","",1640737492000,"","",0,13667,false,false,"","","","","","","","","","","",false
102,0,1,NSO-MEM,E-D19E41,ASA North Slope Orientation,"<p style=\"line-height:normal;background:#FFFFFF;\"><strong><span style=\"color:rgb(41,105,176);\">Average Course Completion Time - 90 minutes</span></strong><span style=\"color:rgb(41,105,176);\"><br></span></p><p>The North Slope Orientation course provides basic safety awareness training specific to the unique climate and working conditions of Alaska's North Slope region. The course gives an overview of camps, travel, environment, working conditions, Operator expectations, and general safety, and complements general industry awareness training, such as Basic Orientation Plus.</p><p><br></p><p><strong><span style=\"color:rgb(61,142,185);\">NOTE</span></strong><span style=\"color:rgb(61,142,185);\">: All North Slope Operators accept the <u>North Slope Orientation combined with </u><u>Basic Orientation Plus (BOP)</u> as an equivalent to the <u>NSTC Unescorted</u> training. </span></p><p><br></p><p><span style=\"color:rgb(61,142,185);\">Please contact the Alaska Safety Alliance with questions about required basic awareness training options for work sites on the North Slope.</span></p>",english,2,0,true,"","",396,"","","",395,fill,"",5400,false,0,medium,true,false,false,false,false,"","","","",0,false,0,0,0,0.0,true,50,elearning,"",0,false,"","",1608763467000,"","",-1,0,0.0,false,true,true,"",true,false,false,false,"","","","",false,false,false,0.00,false,"",true,"","","",true,false,true,false,false,"",665,"","",665,false,"","",false,false,asa-north-slope-orientation,"","","","",false,"","","","",1641341590000,"","",3,13037,false,false,"","","","","","","","","","","",false
135,0,11,22NSTC04UPMEM,E-Y1QPRV,2022 Alaska Safety Handbook Update,<p>This course is designed for individuals who have already completed their NSTC courses and need to update the ASH module. </p>,english,2,0,true,"","",512,"","","",511,fill,"",1800,false,0,medium,true,false,false,false,false,"","","","",0,false,0,0,0,0.0,true,40,elearning,"",0,false,"","",1638574523000,"","",-1,0,0.0,false,true,true,"",false,true,false,false,"","","","",false,false,false,0.00,false,"",true,"","","",true,false,true,false,false,"","","","",621,false,"","",false,false,2022-alaska-safety-handbook-update,"","","","",false,"","","","",1639694425000,"","",3,13038,false,false,"","","","","","","","","","","",false
92,0,13,A29FWA-MEM,I-XVDGPV,Fire Watch  (ARSC),"<p>This <strong>Fire Watch</strong> training applies to all persons who test or monitor the atmosphere, including confined space entrants, and those requiring knowledge of the following principles: </p><p><br /></p><p>•<span style=\"white-space:pre;\">    </span>Define hot work</p><p>•<span style=\"white-space:pre;\">    </span>Describe hot work precautions</p><p>•<span style=\"white-space:pre;\">    </span>Identify when a fire watch is required</p><p>•<span style=\"white-space:pre;\">    </span>Identify the elements for a fire</p><p>•<span style=\"white-space:pre;\">    </span>Define the five classes of fire</p><p>•<span style=\"white-space:pre;\">    </span>Recognize the symbols fire extinguisher classes</p><p>•<span style=\"white-space:pre;\">    </span>Describe precautions for preventing fires from spreading</p><p>•<span style=\"white-space:pre;\">    </span>Identify responsibilities and tasks of a fire watch</p><p>•<span style=\"white-space:pre;\">    </span>Describe the steps for inspection of fire extinguishers before use</p><p>•<span style=\"white-space:pre;\">    </span>List the maximum travel distances to fire extinguishers</p><p>•<span style=\"white-space:pre;\">    </span>Define the Permit Authorizing Individual responsibilities</p><p>•<span style=\"white-space:pre;\">    </span>Identify when hot work permits are invalid and not permitted</p><p>•<span style=\"white-space:pre;\">    </span>Describe supervisor and employee responsibilities </p><p>•<span style=\"white-space:pre;\">    </span>Describe use of fire extinguisher</p><p>•<span style=\"white-space:pre;\">    </span>Describe use of hose line equipment</p><p><br /></p><p style=\"margin:0px 0px 10px;color:rgb(85,85,85);text-transform:none;text-indent:0px;letter-spacing:normal;font-family:'Open Sans', Arial, 'Arial Unicode MS', Helvetica, sans-serif;font-size:14px;font-style:normal;font-weight:400;word-spacing:0px;white-space:normal;background-color:rgb(255,255,255);\"><em>Help us comply with local and state COVID-19 guidelines and mandates by completing our <a href=\"https://www.alaskasafetyalliance.org/health-questionnaire/\" target=\"_blank\" rel=\"noreferrer noopener\"><strong>Health Questionnaire</strong></a> form during the 24 hours prior to your class.</em></p>",english,2,0,true,"","",338,"","","","","","",0,false,0,medium,true,false,false,false,false,"","","","",0,false,0,0,0,0.0,true,35,classroom,"",0,false,"","",1605814521000,"","",-1,0,0.0,false,true,true,"",false,true,false,false,"","","","",false,false,false,0.00,false,"",true,"","","",true,false,true,false,false,"","","","","",false,"","",false,false,fire-watch-arsc,"","","","",false,"","","","",1609804097000,"","",3,13038,false,false,"","","","","","","","","","","",false
86,0,11,NSTC-06CBTMEM,E-Q07K21,PPE Module (NSTC),"<p><br></p><table border=\"0\" cellpadding=\"0\" cellspacing=\"0\" style=\"border-collapse:collapse;\"><tbody><tr><td style=\"width:136.1pt;padding:0in 5.4pt 0in 5.4pt;\" valign=\"top\" width=\"181\"><p>Goal:</p></td><td style=\"width:4.45in;padding:0in 5.4pt 0in 5.4pt;\" valign=\"top\" width=\"427\"><p>To prepare participants to recognize typical job hazards where personal protective equipment (PPE) may be required to minimize the risk of personal injury.</p><p><br></p></td></tr><tr><td style=\"width:136.1pt;padding:0in 5.4pt 0in 5.4pt;\" valign=\"top\" width=\"181\"><p>Objectives:</p></td><td style=\"width:4.45in;padding:0in 5.4pt 0in 5.4pt;\" valign=\"top\" width=\"427\"><p>Participants will be able to:</p><p>Recognize hazards in the workplace.</p><p>Explain the three hazard control measures and give examples of each.</p><p>Describe the PPE required in relation to the task being performed and what part(s) of the body could be injured.</p><p>List the limitations of PPE.</p><p><br></p><p>NSTC - 06</p><p>Revised 1-2022</p></td></tr></tbody></table>",english,2,0,true,"","",339,"","","",349,fill,"",2700,false,0,medium,true,false,false,false,false,"","","","",0,false,0,0,0,0.0,true,20,elearning,"",0,false,"","",1605580007000,"","",-1,0,0.0,false,true,true,"",false,true,false,false,"","","","",false,false,false,0.00,false,"",true,"","","",true,false,true,false,false,"",377,"","",377,false,"","",false,false,ppe-module-nstc,"","","","",false,"","","","",1641341763000,"","",0,13037,false,false,"","","","","","","","","","","",false
43,0,22,NSTC-14-JS,I-5VNPQ0,NSTC: Respiratory Protection: 3: SCBA,<p>NSTC Job Specific Module: Respiratory Protection: 2: Self-Contained Breathing Apparatus (SCBA)</p>,english,0,0,false,"","",283,"","","","","","",0,false,0,medium,true,false,false,false,true,"","","","",0,false,0,0,0,0.0,false,"",classroom,"",0,false,"","",1579038516000,"","",-1,0,0.0,false,true,true,"",false,true,false,false,"","","","",false,false,false,0.00,false,"",true,"","","",true,false,true,false,false,"","","","","",false,"","",false,false,nstc-respiratory-protection-3-scba,"","","","",false,"","","","",1652318620000,"","",3,13028,false,false,"","","","","","","","","","","",false
56,0,11,16615483,E-GVP430,Infection Prevention and Control,"<p>This course covers basic hygiene and how to prevent and control the spread of infection in the workplace. It explains infection prevention and control in the workplace, standard precautions of infection control, common infections and modes of transmission, how to identify and report situations that pose a risk for infection and how to control the spread of infection. It encourages everyone to take responsibility for their own hygiene and to help prevent and control the spread of infection in the workplace.</p>",english,0,0,true,"","",295,"","","","","","",0,false,0,medium,true,false,false,false,false,"","","","",0,false,0,0,0,0.0,false,"",elearning,"",0,false,"","",1584572267000,"","",-1,0,0.0,false,true,true,"",false,true,false,false,"","","","",false,false,false,0.00,false,"",true,"","{\"course_rating_permission\":\"3\"}","{\"course_sharing_permission\":\"1\",\"course_user_share_permission\":\"off\",\"course_share_facebook\":\"off\",\"course_share_twitter\":\"on\",\"course_share_linkedin\":\"on\",\"course_share_google\":\"off\"}",true,false,true,false,false,"",184,"","",184,true,"","",false,false,infection-prevention-and-control,"","","","",false,"","",6,16615483,1586236128000,"","",3,13037,false,false,"","","","","","","","","","","",false
79,0,11,NSTC-08CBTMEM,E-P083JV,HAZWOPER Module (NSTC),<p>The goal of this course is to ensure participants can demonstrate the proper response to releases or potential releases of hazardous substances. First Responder Awareness level.</p>,english,2,0,true,"","",357,"","","",358,fill,"",3600,false,0,medium,true,false,false,false,false,"","","","",0,false,0,0,0,0.0,true,20,elearning,"",0,false,"","",1604973092000,"","",-1,0,0.0,false,true,true,"",false,true,false,false,"","","","",false,false,false,0.00,false,"",true,"","","",true,false,true,false,false,"",355,"","",355,false,"","",false,false,hazwoper-module-nstc,"","","","",false,"","","","",1641342057000,"","",3,13037,false,false,"","","","","","","","","","","",false
108,0,11,NSTC-18CBTMEM,E-GVP9Q1,Asbestos Awareness Module (NSTC),"<p style=\"margin:12pt 0in 0in;font-size:12pt;font-family:Times, serif;\">To introduce employees to the potential hazards and safe work practices for working near Asbestos-Containing Materials (ACM).</p>",english,2,0,true,"","",409,"","","",410,fill,"",1800,false,0,medium,true,false,false,false,false,"","","","",0,false,0,0,0,0.0,true,25,elearning,"",0,false,"","",1612985736000,"","",-1,0,0.0,false,true,true,"",false,true,false,false,"","","","",false,false,false,0.00,false,"",true,"","","",true,false,true,false,false,"",519,"","",519,false,"","",false,false,asbestos-awareness-module-nstc,2,"","","",false,"","","","",1641341119000,"","",3,13667,false,false,"","","","","","","","","","","",false
154,0,22,NSTC-28NON,E-KVOWP0,Energy Isolation 1,"<ul style=\"margin-bottom:0in;color:rgb(32,31,30);font-family:'Segoe UI', 'Segoe UI', '-apple-system', BlinkMacSystemFont, Roboto, 'Helvetica Neue', sans-serif;font-size:15px;font-style:normal;font-weight:400;letter-spacing:normal;text-indent:0px;text-transform:none;white-space:normal;word-spacing:0px;background-color:rgb(255,255,255);margin-top:0in;\" type=\"circle\"><li style=\"margin:0in;font-size:11pt;font-family:Calibri, sans-serif;\"><span style=\"margin:0px;padding:0px;border:0px;font-style:inherit;font-variant:inherit;font-weight:inherit;font-size:10pt;line-height:inherit;font-family:Arial, sans-serif;vertical-align:baseline;color:inherit;\">Identify hazardous energy sources in the workplace</span></li><li style=\"margin:0in;font-size:11pt;font-family:Calibri, sans-serif;\"><span style=\"margin:0px;padding:0px;border:0px;font-style:inherit;font-variant:inherit;font-weight:inherit;font-size:10pt;line-height:inherit;font-family:Arial, sans-serif;vertical-align:baseline;color:inherit;\">Understand the requirements of the Energy Isolation Standard</span></li><li style=\"margin:0in;font-size:11pt;font-family:Calibri, sans-serif;\"><span style=\"margin:0px;padding:0px;border:0px;font-style:inherit;font-variant:inherit;font-weight:inherit;font-size:10pt;line-height:inherit;font-family:Arial, sans-serif;vertical-align:baseline;color:inherit;\">Know how to eliminate, control, and protect against hazardous energy sources, and</span></li><li style=\"margin:0in;font-size:11pt;font-family:Calibri, sans-serif;\"><span style=\"margin:0px;padding:0px;border:0px;font-style:inherit;font-variant:inherit;font-weight:inherit;font-size:10pt;line-height:inherit;font-family:Arial, sans-serif;vertical-align:baseline;color:inherit;\">Understand safe work practices for working around EI devices.</span></li></ul>",english,2,0,true,"","",504,"","","","","","",1800,false,0,medium,true,false,false,false,false,"","","","",0,false,0,0,0,0.0,true,30,elearning,"",0,false,"","",1639775132000,"","",-1,0,0.0,false,true,true,"",false,true,false,false,"","","","",false,false,false,0.00,false,"",true,"","","",true,false,true,false,false,"",699,"","",699,false,"","",false,false,energy-isolation-1,3,"","","",false,"","","","",1640737593000,"","",0,13667,false,false,"","","","","","","","","","","",false
