121,0,3,COPA - NPRACAR,E-G03630,NPR-A Cultural Awareness Refresher,<p>This course is a refresher on National Petroleum Reserve - Alaska cultural awareness.</p>,english,2,0,true,"","",453,"","","",454,fill,"",1800,false,0,medium,true,false,false,false,false,"","","","",365,false,0,0,0,0.0,false,"",elearning,"",0,false,"","",1619474043000,"","",-1,0,0.0,false,true,true,"",false,true,false,false,"","","","",false,false,false,0.00,false,"",true,"","","",true,false,true,false,false,"",577,"","",577,false,"","",false,false,npr-a-cultural-awareness-refresher,"","","","",false,"","","","",1641340723000,"","",0,19466,false,false,"","","","","","","","","","","",false
37,0,12,NSTC-01,I-P0YX21,NSTC Unescorted,"<p>The 8-hour Unescorted Course is required for all employees prior to arrival on the North Slope. It consists</p><p>of 6 modules (the 6-Pack). Each module makes use of lecture, discussion, individual and</p><p> small group exercises, and quizzes to involve employees in their own learning. Upon completion of the</p><p>course, employees receive an NSTC card, which allows them to travel unescorted within and between the</p><p>operating fields to which they are assigned.</p><p><br></p><p> Module I: Introduction, Camps and Safety Orientation is an introduction to the unique working</p><p>conditions at Alaska’s North Slope oil and gas facilities and the importance of working safely.</p><p><br></p><p> Module II: Alaska Safety Handbooks is an overview of the ALASKA SAFETY HANDBOOKS</p><p>which provide the basic safety standards and requirements for daily tasks and projects in the operating</p><p>areas on the North Slope.</p><p><br></p><p> Module III: Personal Protective Equipment provides an overview of typical job hazards where</p><p>personal protective equipment may be required to minimize the risk of injury.</p><p><br></p><p> Module IV: HAZCOM reviews the components of a hazard communication program, the types of</p><p>hazardous chemicals, and the resources available for identifying and controlling those hazards.</p><p><br></p><p> Module V: HAZWOPER, First Responder Awareness focuses on the proper response to releases or</p><p>potential releases of hazardous substances with special emphasis on the DOT Emergency Response</p><p>Guidebook and DOT Pipeline Awareness.</p><p><br></p><p> Module VI: Environmental Excellence emphasizes personal responsibility for following environmental</p><p>rules and regulations relating to air, land, water, wildlife, spills, and waste management as detailed in</p><p>the NORTH SLOPE ENVIRONMENTAL FIELD HANDBOOK.</p>",english,0,0,false,"","",275,"","","","","","",0,false,0,medium,true,false,false,false,true,"","","","",0,false,0,0,0,0.0,false,"",classroom,"",0,false,"","",1576628614000,"","",-1,0,0.0,false,true,true,"",false,false,false,false,"","","","",false,false,false,0.00,false,"",true,"","","",true,false,true,false,false,"","","","","",false,"","",false,false,nstc-unescorted,"","","","",false,"","","","",1652318630000,"","",3,13028,false,false,"","","","","","","","","","","",false
99,0,1,AK-CESCLR-NON,I-J0EE80,AK-CESCL Refresher,"<p>The AK-CESCL Refresher is a summary of the two-day initial AK-CESCL class. This course thoroughly examines erosion and sediment pollution control concepts and design procedures as they apply to construction projects. The Refresher Course is a training and certification program to comply with the Alaska Department of Environmental Conservation Construction General Permit. The Refresher Course will stress risk management, review proper best management practices, and provide guidance.</p><p><br /></p><p><strong>Prerequisites</strong>: An attendee must have an active AK-CESCL number and have completed the two-day (16-hour) or the one-day (8-hour) refresher course within the past 3 years.</p><p><br /></p><p style=\"margin:0px 0px 10px;color:rgb(85,85,85);text-transform:none;text-indent:0px;letter-spacing:normal;font-family:'Open Sans', Arial, 'Arial Unicode MS', Helvetica, sans-serif;font-size:14px;font-style:normal;font-weight:400;word-spacing:0px;white-space:normal;background-color:rgb(255,255,255);\"><em>Help us comply with local and state COVID-19 guidelines and mandates by completing our <a href=\"https://www.alaskasafetyalliance.org/health-questionnaire/\" target=\"_blank\" rel=\"noreferrer noopener\"><strong>Health Questionnaire</strong></a> form during the 24 hours prior to your class.</em></p>",english,2,0,true,"","",372,"","","","","","",0,false,0,medium,true,false,false,false,false,"","","","",0,false,0,0,0,0.0,true,400,classroom,"",0,false,"","",1606084083000,"","",-1,0,0.0,false,true,true,"",false,true,false,false,"","","","",false,false,false,0.00,false,"",true,"","","",true,false,true,false,false,"","","","","",false,"","",false,false,ak-cescl-refresher,"","","",320.00,false,"","","","",1651711315000,"","",3,13037,false,false,"","","","","","","","","","","",false
125,0,3,COPA - HC,E-E0JKKV,Hazard Communication,"<p>This course provides an overview of hazards found on the North Slope, and lists details of the hazard communication program. </p>",english,2,0,true,"","",492,"","","",493,fill,"",1800,false,0,medium,true,false,false,false,false,"","","","",1095,false,0,0,0,0.0,false,"",elearning,"",0,false,"","",1619476681000,"","",-1,0,0.0,false,true,true,"",false,true,false,false,"","","","",false,false,false,0.00,false,"",true,"","","",true,false,true,false,false,"",585,"","",585,false,"","",false,false,hazard-communication,"","","","",false,"","","","",1641340594000,"","",0,19466,false,false,"","","","","","","","","","","",false
116,0,3,COPA - ASH,E-E1L9LV,COPA Alaska Safety Handbook,<p>Conoco Phillips' Alaska Safety Handbook course. This course reviews the changes to the 2018 Alaska Safety Handbook.</p>,english,0,0,true,"","",436,"","","",437,fill,"",3600,false,0,medium,true,false,false,false,false,"",1640908800000,"","",0,false,0,0,0,0.0,false,"",elearning,"",0,false,"","",1619462562000,"","",-1,0,0.0,false,true,true,"",false,true,false,false,"","","","",false,false,false,0.00,false,"",true,"","","",true,false,true,false,false,"",567,"","",567,false,"","",false,false,copa-alaska-safety-handbook,"","","","",false,"","","","",1646424053000,"","",3,19466,false,false,"","","","","","","","","","","",false
160,0,3,COPA PTW CBT,E-Z1GJZ1,COPA Permit to Work (PTW) CBT,"<p style=\"font-size:14px;font-family:effra, sans-serif;\"><span style=\"font-size:inherit;font-family:inherit;\">Permit to Work (PTW) – Initiator and Issuer Competency</span> <span style=\"font-size:inherit;font-family:inherit;\">Training</span></p>
<p style=\"font-size:14px;font-family:effra, sans-serif;\">Course Code:  CPA-REQ-100-MIX   </p>
<p style=\"font-size:14px;font-family:effra, sans-serif;\">Objectives:  Understanding the purpose of Permit to Work, Roles &amp; Responsibilities, form completion, and understanding the process of Permit to Work.   </p>

<p style=\"font-size:14px;font-family:effra, sans-serif;\">This course introduces employees to the Permit to Work process utilized on ConocoPhillips' North Slope work sites. Some topics included are; the purpose of the Permit to Work process, roles and responsibilities of those initiating and issuing permits, the types of permits to be used, and practice of permit completion.  </p>",english,2,0,true,"","",246,"","","","","","",3600,false,0,medium,true,false,false,false,false,"","","","",0,false,0,0,0,0.0,true,100,elearning,"",0,false,"","",1650488676000,"","",-1,0,0.0,false,true,true,"",true,false,false,false,"","","","",false,false,false,0.00,false,"",true,"","","",true,false,true,true,true,"","","","","",true,"","",false,false,copa-permit-to-work-ptw-cbt,"","","","","","","","","",1652726320000,false,"",3,19466,false,false,"","","","","","","","","","","",false
123,0,3,COPA - PSMEAP,E-YVM9Q1,PSM - Alpine Facility Emergency Action Plan,<p>This course provides an overview of process safety management procedures and the emergency action plan at Alpine. </p>,english,2,0,true,"","",449,"","","",450,fill,"",1800,false,0,medium,true,false,false,false,false,"","","","",365,false,0,0,0,0.0,false,"",elearning,"",0,false,"","",1619475617000,"","",-1,0,0.0,false,true,true,"",false,true,false,false,"","","","",false,false,false,0.00,false,"",true,"","","",true,false,true,false,false,"",581,"","",581,false,"","",false,false,psm-alpine-facility-emergency-action-plan,"","","","",false,"","","","",1641340663000,"","",0,19466,false,false,"","","","","","","","","","","",false
72,0,11,NSTC-21CBTNON,E-6VXJ51,NSTC H2S/FeS Module,"<table border=\"0\" cellpadding=\"0\" cellspacing=\"0\" style=\"border-collapse:collapse;\"><tbody><tr style=\"height:.05in;\"><td style=\"width:135.9pt;padding:0in 5.4pt 0in 5.4pt;height:.05in;\" valign=\"top\" width=\"181\"><p>Goal:</p></td><td style=\"width:4.45in;padding:0in 5.4pt 0in 5.4pt;height:.05in;\" valign=\"top\" width=\"427\"><p>To ensure participants can recognize the hazardous characteristics of hydrogen sulfide (H<sub>2</sub>S) and iron sulfide (FeS) and correctly apply the standards and procedures to safely perform work in areas where H<sub>2</sub>S and FeS are found.</p></td></tr><tr style=\"height:.05in;\"><td style=\"width:135.9pt;padding:0in 5.4pt 0in 5.4pt;height:.05in;\" valign=\"top\" width=\"181\"><p> Objectives:</p></td><td style=\"width:4.45in;padding:0in 5.4pt 0in 5.4pt;height:.05in;\" valign=\"top\" width=\"427\"><p>Participants will be able to:</p><p>Identify the characteristics of H<sub>2</sub>S.</p><p>List the hazards of H<sub>2</sub>S.</p><p>Describe the effects of various H<sub>2</sub>S concentration levels on humans.</p><p>Recognize the need for monitors and alarms which identify the specific levels of H<sub>2</sub>S concentrations.</p><p>Describe the proper notification procedures for an H<sub>2</sub>S emergency.</p><p>Describe the appropriate rescue and emergency procedures for a person exposed to high levels of H<sub>2</sub>S.</p><p><br></p><p>NSTC-21</p><p>Revised 1-2022</p></td></tr></tbody></table>",english,2,0,true,"","",362,"","","",363,fill,"",3600,false,0,medium,true,false,false,false,false,"","","","",0,false,0,0,0,0.0,true,30,elearning,"",0,false,"","",1601933606000,"","",-1,0,0.0,false,true,true,"",false,true,false,false,"","","","",false,false,false,0.00,false,"",true,"","","",true,false,true,false,false,"",499,"","",499,false,"","",false,false,nstc-h2sfes-module,2,"","",24.00,false,"","","","",1641341698000,"","",3,13039,false,false,"","","","","","","","","","","",false
153,0,22,NSTC-16NON,E-E04XR0,Energy Isolation 2,"<p><span style=\"margin:0px;padding:0px;border:0px;font-style:inherit;font-variant:inherit;font-weight:inherit;font-size:10pt;line-height:inherit;font-family:Arial, sans-serif;vertical-align:baseline;color:inherit;\"><i style=\"color:rgb(32,31,30);font-family:Calibri, sans-serif;font-size:14.6667px;font-weight:400;letter-spacing:normal;text-indent:0px;text-transform:none;white-space:normal;word-spacing:0px;background-color:rgb(255,255,255);\"><span style=\"margin:0px;padding:0px;border:0px;font:inherit;vertical-align:baseline;color:#FF0000;\">              Energy Isolation 1 is a prerequisite before taking Energy Isolation 2</span></i><br></span></p><ul style=\"margin-bottom:0in;color:rgb(32,31,30);font-family:'Segoe UI', 'Segoe UI', '-apple-system', BlinkMacSystemFont, Roboto, 'Helvetica Neue', sans-serif;font-size:15px;font-style:normal;font-weight:400;letter-spacing:normal;text-indent:0px;text-transform:none;white-space:normal;word-spacing:0px;background-color:rgb(255,255,255);margin-top:0in;\" type=\"disc\"><li style=\"margin:0in 0in 0in .5in;font-size:11pt;font-family:Calibri, sans-serif;\"><span style=\"margin:0px;padding:0px;border:0px;font-style:inherit;font-variant:inherit;font-weight:inherit;font-size:10pt;line-height:inherit;font-family:Arial, sans-serif;vertical-align:baseline;color:inherit;\">Understand Energy Isolation procedures and documents</span></li><li style=\"margin:0in 0in 0in .5in;font-size:11pt;font-family:Calibri, sans-serif;\"><span style=\"margin:0px;padding:0px;border:0px;font-style:inherit;font-variant:inherit;font-weight:inherit;font-size:10pt;line-height:inherit;font-family:Arial, sans-serif;vertical-align:baseline;color:inherit;\">Identify the types of locks, devices and tags used to isolate energy sources</span></li><li style=\"margin:0in 0in 0in .5in;font-size:11pt;font-family:Calibri, sans-serif;\"><span style=\"margin:0px;padding:0px;border:0px;font-style:inherit;font-variant:inherit;font-weight:inherit;font-size:10pt;line-height:inherit;font-family:Arial, sans-serif;vertical-align:baseline;color:inherit;\">Explain and follow the proper steps for implementing an energy isolation strategy, and</span></li><li style=\"margin:0in 0in 0in .5in;font-size:11pt;font-family:Calibri, sans-serif;\"><span style=\"margin:0px;padding:0px;border:0px;font-style:inherit;font-variant:inherit;font-weight:inherit;font-size:10pt;line-height:inherit;font-family:Arial, sans-serif;vertical-align:baseline;color:inherit;\">Apply and verify energy isolation controls.</span></li></ul>",english,2,0,true,"","",505,"","","","","","",3600,false,0,medium,true,false,false,false,false,"","","","",0,false,0,0,0,0.0,true,55,elearning,"",0,false,"","",1639775066000,"","",-1,0,0.0,false,true,true,"",false,true,false,false,"","","","",false,false,false,0.00,false,"",true,"","","",true,false,true,false,false,"",697,"","",697,false,"","",false,false,energy-isolation-2,3,"","","",false,"","","","",1640737648000,"","",0,13667,false,false,"","","","","","","","","","","",false
126,0,3,COPA - AFPSM,E-D19N41,Alpine Facility PSM Overview,"<p>This course provides a brief overview of the Alpine Process Facilities, Facility Protection Safety System, Safety Orientation and Procedures. </p>",english,2,0,true,"","",440,"","","",441,fill,"",3600,false,0,medium,true,false,false,false,false,"","","","",1095,false,0,0,0,0.0,false,"",elearning,"",0,false,"","",1619477231000,"","",-1,0,0.0,false,true,true,"",false,true,false,false,"","","","",false,false,false,0.00,false,"",true,"","","",true,false,true,false,false,"",587,"","",587,false,"","",false,false,alpine-facility-psm-overview,"","","","",false,"","","","",1641340561000,"","",0,19466,false,false,"","","","","","","","","","","",false
157,0,3,COPA - ASH,E-O069P0,COPA 2022 Alaska Safety Handbook,<p>Conoco Phillips' Alaska Safety Handbook course. This course reviews the changes to the 2022 Alaska Safety Handbook.</p>,english,2,0,true,"","",436,"","","",437,fill,"",3600,false,0,medium,true,false,false,false,false,"","","","",0,false,0,0,0,0.0,false,"",elearning,"",0,false,"","",1642207711000,"","",-1,0,0.0,false,true,true,"",false,true,false,false,"","","","",false,false,false,0.00,false,"",true,"","","",true,false,true,false,false,"",740,"","",740,false,"","",false,false,copa-2022-alaska-safety-handbook,"","","","",false,"","","","",1645208742000,"","",0,19466,false,false,"","","","","","","","","","","",false
57,0,11,18NSTC04UPNON,E-O063R0,2018 Alaska Safety Handbook Update,<p>This course is designed for individuals who have already completed their NSTC courses and need to update the ASH module. </p>,english,0,0,true,"","",366,"","","",367,fill,"",0,false,0,medium,true,false,false,false,false,"","","","",0,false,0,0,0,0.0,true,40,elearning,"",0,false,"","",1585001310000,"","",-1,0,0.0,false,true,true,"",true,true,false,false,"","","","",false,false,false,0.00,false,"",true,"","","",false,false,true,false,false,"",281,"","",281,false,"","",false,false,2018-alaska-safety-handbook-update,"","","",24.00,false,"","","","",1640890747000,true,"",3,13028,false,false,"","","","","","","","","","","",false
152,0,22,NSTC-20NON,E-6027N1,Fall Protection,"<p style=\"margin:0in;font-size:11pt;font-family:Calibri, sans-serif;color:rgb(32,31,30);font-style:normal;font-weight:400;letter-spacing:normal;text-indent:0px;text-transform:none;white-space:normal;word-spacing:0px;background-color:rgb(255,255,255);\"><em><span style=\"color:rgb(226,80,65);\">**Fall Protection Module 1 must be completed before taking Module 2**</span></em></p><p style=\"margin:0in;font-size:11pt;font-family:Calibri, sans-serif;color:rgb(32,31,30);font-style:normal;font-weight:400;letter-spacing:normal;text-indent:0px;text-transform:none;white-space:normal;word-spacing:0px;background-color:rgb(255,255,255);\"><strong>FP Module 1 Course objectives:</strong></p><ul style=\"margin-bottom:0in;color:rgb(32,31,30);font-family:'Segoe UI', 'Segoe UI', '-apple-system', BlinkMacSystemFont, Roboto, 'Helvetica Neue', sans-serif;font-size:15px;font-style:normal;font-weight:400;letter-spacing:normal;text-indent:0px;text-transform:none;white-space:normal;word-spacing:0px;background-color:rgb(255,255,255);margin-top:0in;\" type=\"disc\"><li><ul style=\"margin-bottom:0in;margin-top:0in;\" type=\"circle\"><li style=\"margin:0in;font-size:11pt;font-family:Calibri, sans-serif;\"><span style=\"margin:0px;padding:0px;border:0px;font-style:inherit;font-variant:inherit;font-weight:inherit;font-size:10pt;line-height:inherit;font-family:Arial, sans-serif;vertical-align:baseline;color:inherit;\">Define the fall protection standard, terms and definitions.</span></li><li style=\"margin:0in;font-size:11pt;font-family:Calibri, sans-serif;\"><span style=\"margin:0px;padding:0px;border:0px;font-style:inherit;font-variant:inherit;font-weight:inherit;font-size:10pt;line-height:inherit;font-family:Arial, sans-serif;vertical-align:baseline;color:inherit;\">Explain the importance of fall protection in preventing injuries and fatalities.</span></li><li style=\"margin:0in;font-size:11pt;font-family:Calibri, sans-serif;\"><span style=\"margin:0px;padding:0px;border:0px;font-style:inherit;font-variant:inherit;font-weight:inherit;font-size:10pt;line-height:inherit;font-family:Arial, sans-serif;vertical-align:baseline;color:inherit;\">Identify, assess, and control fall hazards.</span></li><li style=\"margin:0in;font-size:11pt;font-family:Calibri, sans-serif;\"><span style=\"margin:0px;padding:0px;border:0px;font-style:inherit;font-variant:inherit;font-weight:inherit;font-size:10pt;line-height:inherit;font-family:Arial, sans-serif;vertical-align:baseline;color:inherit;\">List situations in which fall protection must be used.</span></li><li style=\"margin:0in;font-size:11pt;font-family:Calibri, sans-serif;\"><span style=\"margin:0px;padding:0px;border:0px;font-style:inherit;font-variant:inherit;font-weight:inherit;font-size:10pt;line-height:inherit;font-family:Arial, sans-serif;vertical-align:baseline;color:inherit;\">Explain requirements for using fall prevention, and the protection needed when climbing ladders.</span></li></ul></li></ul><p style=\"margin:0in;font-size:11pt;font-family:Calibri, sans-serif;color:rgb(32,31,30);font-style:normal;font-weight:400;letter-spacing:normal;text-indent:0px;text-transform:none;white-space:normal;word-spacing:0px;background-color:rgb(255,255,255);\"><strong>FP Module 2 Course objectives:</strong></p><ul style=\"margin-bottom:0in;color:rgb(32,31,30);font-family:'Segoe UI', 'Segoe UI', '-apple-system', BlinkMacSystemFont, Roboto, 'Helvetica Neue', sans-serif;font-size:15px;font-style:normal;font-weight:400;letter-spacing:normal;text-indent:0px;text-transform:none;white-space:normal;word-spacing:0px;background-color:rgb(255,255,255);margin-top:0in;\" type=\"disc\"><li><ul style=\"margin-bottom:0in;margin-top:0in;\" type=\"circle\"><li style=\"margin:0in;font-size:11pt;font-family:Calibri, sans-serif;\"><span style=\"margin:0px;padding:0px;border:0px;font-style:inherit;font-variant:inherit;font-weight:inherit;font-size:10pt;line-height:inherit;font-family:Arial, sans-serif;vertical-align:baseline;color:inherit;\">Demonstrate how to correctly inspect, don, doff, adjust, and use fall protection equipment.</span></li><li style=\"margin:0in;font-size:11pt;font-family:Calibri, sans-serif;\"><span style=\"margin:0px;padding:0px;border:0px;font-style:inherit;font-variant:inherit;font-weight:inherit;font-size:10pt;line-height:inherit;font-family:Arial, sans-serif;vertical-align:baseline;color:inherit;\">Determine if your personal fall arrest system (PFAS) has adequate clearance to fully deploy in a given </span>situation without causing injury.</li><li style=\"margin:0in;font-size:11pt;font-family:Calibri, sans-serif;\"><span style=\"margin:0px;padding:0px;border:0px;font-style:inherit;font-variant:inherit;font-weight:inherit;font-size:10pt;line-height:inherit;font-family:Arial, sans-serif;vertical-align:baseline;color:inherit;\">Explain how to care for and maintain fall protection equipment.</span></li><li style=\"margin:0in;font-size:11pt;font-family:Calibri, sans-serif;\"><span style=\"margin:0px;padding:0px;border:0px;font-style:inherit;font-variant:inherit;font-weight:inherit;font-size:10pt;line-height:inherit;font-family:Arial, sans-serif;vertical-align:baseline;color:inherit;\">Ask the appropriate person(s) about fall protection equipment types, use, and acceptable anchorages.</span></li><li style=\"margin:0in;font-size:11pt;font-family:Calibri, sans-serif;\"><span style=\"margin:0px;padding:0px;border:0px;font-style:inherit;font-variant:inherit;font-weight:inherit;font-size:10pt;line-height:inherit;font-family:Arial, sans-serif;vertical-align:baseline;color:inherit;\">Explain what to do if you or a co-worker falls while wearing fall protection equipment, and how to summon rescue personnel.</span></li><li style=\"margin:0in;font-size:11pt;font-family:Calibri, sans-serif;\"><span style=\"margin:0px;padding:0px;border:0px;font-style:inherit;font-variant:inherit;font-weight:inherit;font-size:10pt;line-height:inherit;font-family:Arial, sans-serif;vertical-align:baseline;color:inherit;\">Explain suspension trauma and what actions can prevent or reduce it.</span><span style=\"margin:0px;padding:0px;border:0px;font-style:inherit;font-variant:inherit;font-weight:inherit;font-size:10pt;line-height:inherit;font-family:Arial, sans-serif;vertical-align:baseline;color:inherit;\"></span></li></ul></li></ul><p><span style=\"margin:0px;padding:0px;border:0px;font-style:inherit;font-variant:inherit;font-weight:inherit;font-size:10pt;line-height:inherit;font-family:Arial, sans-serif;vertical-align:baseline;color:inherit;\"><i style=\"color:rgb(32,31,30);font-family:Calibri, sans-serif;font-size:14.6667px;font-weight:400;letter-spacing:normal;text-indent:0px;text-transform:none;white-space:normal;word-spacing:0px;background-color:rgb(255,255,255);\"><span style=\"margin:0px;padding:0px;border:0px;font:inherit;vertical-align:baseline;color:#FF0000;\">NOTE: Fall Protection is the ONLY Job Specific course that also requires the hands on completion of the FP Performance Profile Sheet</span></i><br /></span></p>",english,2,0,true,"","",515,"","","",526,fill,"",9000,false,0,medium,true,false,false,false,false,"","","","",0,false,0,0,0,0.0,true,105,elearning,"",0,false,"","",1639774960000,"","",-1,0,0.0,false,true,true,"",false,true,false,false,"","","","",false,false,false,0.00,false,"",true,"","","",true,false,true,false,false,single_LO_as_final,709,"",single_LO_as_initial,692,false,"","",false,false,fall-protection,3,"","","",false,"","","","",1641320460000,"","",0,13667,false,false,"","","","","","","","","","","",false
84,0,1,NSTC-03CBTMEM,E-Z1GP91,North Slope Camps & Safety Orientation Module (NSTC),<p>The goal of this training module is to introduce participants to the unique working conditions at Alaska’s North Slope oil and gas facilities and explain the safety culture currently in practice.</p>,english,2,0,true,"","",355,"","","",356,fill,"",1800,false,0,medium,true,false,false,false,false,"","","","",0,false,0,0,0,0.0,true,20,elearning,"",0,false,"","",1605579299000,"","",-1,0,0.0,false,true,true,"",false,true,false,false,"","","","",false,false,false,0.00,false,"",true,"","","",true,false,true,false,false,"",371,"","",371,false,"","",false,false,north-slope-camps-safety-orientation-module-nstc,"","","","",false,"","","","",1641341942000,"","",0,13037,false,false,"","","","","","","","","","","",false
